{
  "이름": "양극재_수세_효과",
  "스타일": "단정",
  "글자체": "맑은 고딕",
  "장": [
    {
      "종류": "표지",
      "큰말": "NCM 양극재 수세 후 1차 입자 변화",
      "작은말": "SEM 관찰과 입자 크기 분포 비교",
      "발표자": "Hoya · 2026. 10",
      "그림": "소재/SEM_2차입자_x6350.tif",
      "노트": "오늘은 수세 공정이 1차 입자 모양과 크기에 주는 영향을 SEM으로 본 결과를 공유합니다."
    },
    {
      "종류": "한마디",
      "큰말": "수세 뒤 1차 입자는 더 둥글고 고르게 바뀌었다",
      "작은말": "D50은 거의 같지만 분포 폭(σ)이 18% 줄었다"
    },
    {
      "종류": "글그림",
      "제목": "표면의 1차 입자가 둥글어졌다",
      "글": [
        "모서리가 날카롭던 다면체 입자가 수세 뒤 둥근 모양으로 바뀌었다",
        "입자 사이 틈이 넓어져 전해액이 스며들 길이 늘었다",
        "잔류 리튬(Li2CO3) 덩어리는 눈에 띄게 줄었다"
      ],
      "그림": "소재/SEM_1차입자_x31750.tif",
      "그림설명": "SEM ×31,750 · 수세 후 표면"
    },
    {
      "종류": "도표",
      "제목": "수세 후 수명이 더 오래 간다",
      "표": "재료/002_수세실험_데이터/표/수명.json",
      "모양": "선",
      "설명": "500사이클 용량 유지율: 수세 전 77% → 수세 후 92%"
    },
    {
      "종류": "표",
      "제목": "입도 분포는 좁아졌다",
      "표": "재료/002_수세실험_데이터/표/입도분포.json",
      "설명": "레이저 회절 입도 분석 · 시료당 3회 평균"
    },
    {
      "종류": "도표",
      "제목": "D90이 줄어 분포 폭이 좁아졌다",
      "표": "재료/002_수세실험_데이터/표/입도분포.json",
      "모양": "막대",
      "단위": "µm"
    },
    {
      "종류": "글만",
      "제목": "A사 미팅에서 정한 것",
      "글": [
        "수세 조건(물:분말 비율 2종)에 따른 입도 분포와 500사이클 수명 데이터를 다음 미팅에서 비교한다.",
        "당사: 수세 전후 D10·D50·D90 표 정리, 단면 SEM 추가 촬영 (10월 20일까지)",
        "A사: 500사이클 셀 데이터 공유 (10월 24일까지)"
      ]
    }
  ]
}