{
 "이름": "A사_2차미팅_수세조건",
 "스타일": "단정",
 "글자체": "맑은 고딕",
 "발표분": 10,
 "장": [
  {
   "종류": "표지",
   "큰말": "수세 1:2 조건에서 500사이클 유지율 92%",
   "작은말": "NCM 양극재 수세 조건 비교 · A사 2차 미팅",
   "발표자": "소재연구팀 Hoya · 2026. 10",
   "그림": "재료/004_SEM_2차입자_x6350/그림/SEM_2차입자_x6350.tif",
   "노트": "지난 미팅에서 주신 질문에 대한 답을 가져왔습니다. 결론부터 말씀드리면, 수세 후 500사이클까지는 수명이 오히려 좋아졌습니다."
  },
  {
   "종류": "인용",
   "인용": "1차 입자 표면의 변화가 장기 수명에 미치는 영향을 데이터로 확인",
   "누가": "1차 미팅 회의록, 10월 8일",
   "노트": "1차 미팅에서 잔류 리튬이 줄어든 것은 좋게 보셨지만, 표면이 바뀌는 것이 수명에 어떤 영향을 주는지 데이터로 보고 싶다고 하셨습니다. 오늘은 그 질문 하나에 답합니다."
  },
  {
   "종류": "한마디",
   "큰말": "표면은 바뀌었지만, 수명은 오히려 좋아졌다",
   "작은말": "500사이클 용량 유지율: 수세 전 77% → 수세 후 92%",
   "노트": "표면이 바뀌면 수명에 나쁠 수 있다는 걱정이 있었는데, 적어도 500사이클까지는 반대였습니다. 다만 코인셀 결과라서 풀셀 확인은 남아 있습니다."
  },
  {
   "종류": "흐름",
   "제목": "같은 분말을 물 비율 두 가지로 씻었다",
   "단계": [
    "물과 섞기 (1:1, 1:2)",
    "30분 교반",
    "거르기",
    "120 ℃ 건조",
    "열처리"
   ],
   "노트": "물과 분말의 비율만 1:1과 1:2로 바꾸고 나머지 공정은 같게 했습니다. 입도는 레이저 회절로 시료당 세 번 재서 평균했고, 수명은 코인셀 0.5C로 500사이클 돌렸습니다."
  },
  {
   "종류": "사진격자",
   "제목": "2차 입자는 그대로, 1차 입자는 둥글어졌다",
   "그림들": [
    "재료/004_SEM_2차입자_x6350/그림/SEM_2차입자_x6350.tif",
    "재료/005_SEM_1차입자_x31750/그림/SEM_1차입자_x31750.tif"
   ],
   "라벨들": [
    "2차 입자 ×6,350",
    "1차 입자 표면 ×31,750"
   ],
   "노트": "왼쪽처럼 공 모양의 2차 입자는 수세 뒤에도 깨지지 않았습니다. 오른쪽 1차 입자 표면을 보면 모서리가 둥글어졌습니다."
  },
  {
   "종류": "표",
   "제목": "D90이 15.8 → 14.1 µm로 줄었다",
   "표": "재료/002_수세실험_데이터/표/입도분포.json",
   "설명": "레이저 회절 · 시료당 세 번 잰 평균",
   "노트": "가운데 크기인 D50은 10 µm 근처로 거의 같습니다. 바뀐 것은 큰 입자 쪽인 D90으로, 물을 많이 쓸수록 더 줄었습니다."
  },
  {
   "종류": "숫자",
   "제목": "1:2 조건에서 분포 폭이 21% 좁아졌다",
   "숫자들": [
    "0.95 | 수세 전 분포 폭",
    "0.81 | 수세 후 1:1",
    "0.75 | 수세 후 1:2"
   ],
   "노트": "분포 폭은 (D90 − D10) ÷ D50으로 계산했습니다. 0.95에서 0.75로, 입자 크기가 더 고르게 모였다는 뜻입니다."
  },
  {
   "종류": "도표",
   "제목": "300사이클부터 유지율 차이가 벌어졌다",
   "표": "재료/002_수세실험_데이터/표/수명.json",
   "모양": "선",
   "단위": "%",
   "설명": "코인셀 · 0.5C · 수세 후는 1:2 조건",
   "노트": "초반 200사이클까지는 차이가 크지 않다가, 1차 미팅에서 관심을 보이신 300사이클 이후로 벌어집니다. 500사이클에서 77%와 92%입니다."
  },
  {
   "종류": "비교",
   "제목": "1:2가 더 좋지만 물을 두 배 쓴다",
   "왼제목": "수세 1:1",
   "왼글": [
    "D90 14.6 µm",
    "분포 폭 0.81",
    "물 사용량 기준"
   ],
   "오른제목": "수세 1:2",
   "오른글": [
    "D90 14.1 µm",
    "분포 폭 0.75",
    "500사이클 유지율 92%",
    "물 사용량 두 배"
   ],
   "노트": "입도만 보면 1:2가 더 좋습니다. 다만 물을 두 배 쓰기 때문에 공정 비용이 오릅니다. 수명 시험은 1:2 조건으로만 했습니다. 양산 관점에서 의견을 듣고 싶습니다."
  },
  {
   "종류": "결론",
   "제목": "500사이클까지는 수세가 수명에 도움이 됐다",
   "결론": [
    "수세 뒤 1차 입자 표면이 둥글어지고 D90이 줄었다",
    "500사이클 유지율 77% → 92% (코인셀)",
    "원인이 잔류 리튬인지 표면인지는 아직 모른다"
   ],
   "다음": [
    "A사 500사이클 셀 데이터와 비교",
    "단면 SEM 촬영",
    "1:2 조건 풀셀 시험",
    "물을 줄인 1:1.5 조건 시험"
   ],
   "노트": "아직 모르는 것도 분명히 말씀드립니다. 코인셀 결과라 풀셀에서 같을지는 A사 셀 데이터와 맞춰 봐야 하고, 수명이 좋아진 원인을 잔류 리튬과 표면 변화로 나누지는 못했습니다."
  },
  {
   "종류": "끝",
   "큰말": "감사합니다",
   "작은말": "1:2 조건의 물 사용량, 양산에서 괜찮을지 의견을 듣고 싶습니다",
   "노트": "질문 받겠습니다. 특히 물 사용량이 두 배인 점이 양산에서 괜찮을지 의견을 부탁드립니다."
  }
 ]
}