{
 "이름": "장 종류 모음",
 "스타일": "단정",
 "글자체": "맑은 고딕",
 "장": [
  {
   "종류": "표지",
   "큰말": "NCM 양극재 수세 후 1차 입자 변화",
   "작은말": "SEM 관찰과 입자 크기 분포 비교",
   "발표자": "Hoya · 2026. 10",
   "그림": "소재/SEM_2차입자_x6350.tif"
  },
  {
   "종류": "목차",
   "제목": "오늘 이야기할 것",
   "항목": [
    "왜 수세를 하나",
    "SEM으로 본 입자 모양",
    "입도 분포와 수명",
    "A사와 정한 다음 일"
   ]
  },
  {
   "종류": "한마디",
   "큰말": "수세 뒤 1차 입자는 더 둥글고 고르게 바뀌었다",
   "작은말": "D50은 거의 같지만 분포 폭(σ)이 18% 줄었다"
  },
  {
   "종류": "글그림",
   "제목": "표면의 1차 입자가 둥글어졌다",
   "글": [
    "모서리가 날카롭던 다면체 입자가 수세 뒤 둥근 모양으로 바뀌었다",
    "입자 사이 틈이 넓어져 전해액이 스며들 길이 늘었다"
   ],
   "그림": "소재/SEM_1차입자_x31750.tif",
   "그림설명": "SEM ×31,750 · 수세 후 표면"
  },
  {
   "종류": "비교",
   "제목": "수세 전과 후",
   "왼제목": "수세 전",
   "왼글": [
    "다면체, 모서리 날카로움",
    "잔류 리튬 덩어리 많음"
   ],
   "왼그림": "소재/SEM_2차입자_x6350.tif",
   "오른제목": "수세 후",
   "오른글": [
    "둥근 입자, 틈 넓어짐",
    "잔류 리튬 줄어듦"
   ],
   "오른그림": "소재/SEM_1차입자_x31750.tif"
  },
  {
   "종류": "숫자",
   "제목": "숫자로 본 수세 효과",
   "숫자들": [
    "92% | 500사이클 용량 유지율",
    "−18% | 입도 분포 폭(σ)",
    "0.3% | 잔류 리튬"
   ]
  },
  {
   "종류": "흐름",
   "제목": "수세 공정",
   "단계": [
    "물과 섞기",
    "교반 30분",
    "거르기",
    "건조 120 ℃",
    "열처리"
   ]
  },
  {
   "종류": "도표",
   "제목": "수세 후 수명이 더 오래 간다",
   "표": "재료/002_수세실험_데이터/표/수명.json",
   "모양": "선",
   "설명": "500사이클 용량 유지율: 수세 전 77% → 수세 후 92%"
  },
  {
   "종류": "표",
   "제목": "입도 분포는 좁아졌다",
   "표": "재료/002_수세실험_데이터/표/입도분포.json",
   "설명": "레이저 회절 입도 분석 · 시료당 3회 평균"
  },
  {
   "종류": "결과해석",
   "제목": "수세가 수명을 늘렸다",
   "그림": "소재/SEM_1차입자_x31750.tif",
   "숫자들": [
    "+15%p | 500사이클 유지율",
    "−18% | 분포 폭"
   ],
   "해석": "표면 잔류 리튬이 줄어 부반응이 줄었다고 본다"
  },
  {
   "종류": "사진격자",
   "제목": "배율별 SEM",
   "그림들": [
    "소재/SEM_2차입자_x6350.tif",
    "소재/SEM_1차입자_x31750.tif"
   ],
   "라벨들": [
    "2차 입자 ×6,350",
    "1차 입자 ×31,750"
   ]
  },
  {
   "종류": "인용",
   "인용": "분포 폭이 줄면 극판 밀도를 더 올릴 수 있겠네요.",
   "누가": "A사 연구소, 10월 미팅"
  },
  {
   "종류": "사진가득",
   "그림": "소재/SEM_2차입자_x6350.tif",
   "제목": "2차 입자 전체 모양은 그대로다",
   "글": "SEM ×6,350 · 수세 후"
  },
  {
   "종류": "글만",
   "제목": "A사 미팅에서 정한 것",
   "글": [
    "수세 조건 2종의 입도 분포와 500사이클 수명을 다음 미팅에서 비교한다.",
    "당사: D10·D50·D90 표 정리, 단면 SEM 추가 (10월 20일까지)"
   ]
  },
  {
   "종류": "결론",
   "제목": "정리",
   "결론": [
    "수세는 1차 입자를 둥글게 만든다",
    "분포 폭이 18% 줄었다",
    "수명이 15%p 늘었다"
   ],
   "다음": [
    "물:분말 비율 2종 비교",
    "단면 SEM",
    "A사 셀 데이터 받기"
   ]
  },
  {
   "종류": "끝",
   "큰말": "감사합니다",
   "작은말": "Hoya · 질문은 언제든"
  }
 ]
}