{
  "이름": "ACME 중간보고",
  "장": [
    {
      "종류": "원본장",
      "원본": 1
    },
    {
      "종류": "원본장",
      "원본": 2,
      "고침": {
        "3": "수세 조건 2종 시험 완료\n입도 분석 완료: D90 15.8 → 14.1 µm\n수명 시험 500사이클 완료"
      }
    },
    {
      "종류": "도표",
      "제목": "수세 후 수명이 더 오래 간다",
      "표": "재료/002_수세실험_데이터/표/수명.json",
      "모양": "선",
      "설명": "500사이클 용량 유지율 77% → 92%"
    }
  ],
  "바탕": {
    "재료": "001_ACME_중간보고_v1",
    "파일": "재료/001_ACME_중간보고_v1/원본.pptx",
    "원래이름": "ACME_중간보고_v1.pptx"
  },
  "스타일": {
    "이름": "v1 템플릿",
    "설명": "원본 템플릿의 테마",
    "색": {
      "바탕": "#FFFFFF",
      "면": "#F0F0F0",
      "글": "#000000",
      "흐린글": "#595959",
      "강조": "#C8102E",
      "선": "#D1D1D1"
    },
    "계열": [
      "#C8102E",
      "#1F4E79",
      "#7F7F7F",
      "#F2A900"
    ]
  },
  "글자체": "맑은 고딕"
}